{
  "results": [
    {
      "locator": "results",
      "messages": [
        "Target path exists, but locator semantics were not interpreted by the base verifier."
      ],
      "raw_reference": "@evidence[[paper_data.json#results]]",
      "resolved_path": "paper_data.json",
      "status": "anchored",
      "subject_kind": "text-artifact",
      "subject_path": "figures/make_graphical_abstract.py",
      "target": "paper_data.json"
    },
    {
      "locator": "implementation_details.objective_counts",
      "messages": [
        "Target path exists, but locator semantics were not interpreted by the base verifier."
      ],
      "raw_reference": "@evidence[[paper_data.json#implementation_details.objective_counts]]",
      "resolved_path": "paper_data.json",
      "status": "anchored",
      "subject_kind": "text-artifact",
      "subject_path": "figures/make_graphical_abstract.py",
      "target": "paper_data.json"
    },
    {
      "locator": "limitations",
      "messages": [
        "Target path exists, but locator semantics were not interpreted by the base verifier."
      ],
      "raw_reference": "@evidence[[paper_data.json#limitations]]",
      "resolved_path": "paper_data.json",
      "status": "anchored",
      "subject_kind": "text-artifact",
      "subject_path": "figures/make_graphical_abstract.py",
      "target": "paper_data.json"
    },
    {
      "locator": "grounding_sources.retrieval-ranking-implementation",
      "messages": [
        "Target path exists, but locator semantics were not interpreted by the base verifier."
      ],
      "raw_reference": "@evidence[[paper_data.json#grounding_sources.retrieval-ranking-implementation]]",
      "resolved_path": "paper_data.json",
      "status": "anchored",
      "subject_kind": "text-artifact",
      "subject_path": "figures/make_graphical_abstract.py",
      "target": "paper_data.json"
    },
    {
      "locator": "results",
      "messages": [
        "Target path exists, but locator semantics were not interpreted by the base verifier."
      ],
      "raw_reference": "@evidence[[paper_data.json#results]]",
      "resolved_path": "paper_data.json",
      "status": "anchored",
      "subject_kind": "text-artifact",
      "subject_path": "figures/make_graphical_abstract.py",
      "target": "paper_data.json"
    },
    {
      "locator": "implementation_details.objective_counts",
      "messages": [
        "Target path exists, but locator semantics were not interpreted by the base verifier."
      ],
      "raw_reference": "@evidence[[paper_data.json#implementation_details.objective_counts]]",
      "resolved_path": "paper_data.json",
      "status": "anchored",
      "subject_kind": "text-artifact",
      "subject_path": "figures/make_graphical_abstract.py",
      "target": "paper_data.json"
    },
    {
      "locator": "grounding_sources.retrieval-ranking-implementation",
      "messages": [
        "Target path exists, but locator semantics were not interpreted by the base verifier."
      ],
      "raw_reference": "@evidence[[paper_data.json#grounding_sources.retrieval-ranking-implementation]]",
      "resolved_path": "paper_data.json",
      "status": "anchored",
      "subject_kind": "text-artifact",
      "subject_path": "figures/make_graphical_abstract.py",
      "target": "paper_data.json"
    },
    {
      "messages": [
        "Target path exists."
      ],
      "raw_reference": "@evidence[[figures/make_graphical_abstract.py]]",
      "resolved_path": "figures/make_graphical_abstract.py",
      "status": "resolved",
      "subject_kind": "text-artifact",
      "subject_path": "figures/make_graphical_abstract.py",
      "target": "figures/make_graphical_abstract.py"
    },
    {
      "locator": "grounding_sources.retrieval-ranking-implementation",
      "messages": [
        "Target path exists, but locator semantics were not interpreted by the base verifier."
      ],
      "raw_reference": "@evidence[[paper_data.json#grounding_sources.retrieval-ranking-implementation]]",
      "resolved_path": "paper_data.json",
      "status": "anchored",
      "subject_kind": "text-artifact",
      "subject_path": "figures/make_pareto_overview.py",
      "target": "paper_data.json"
    },
    {
      "locator": "results",
      "messages": [
        "Target path exists, but locator semantics were not interpreted by the base verifier."
      ],
      "raw_reference": "@evidence[[paper_data.json#results]]",
      "resolved_path": "paper_data.json",
      "status": "anchored",
      "subject_kind": "text-artifact",
      "subject_path": "paper.tex",
      "target": "paper_data.json"
    },
    {
      "locator": "Tests run: 14, Failures: 0, Errors: 0",
      "messages": [
        "Target path exists, but locator semantics were not interpreted by the base verifier."
      ],
      "raw_reference": "@evidence[[results/kernel/memory-tests-final-14-post-coverage-fix.log#Tests run: 14, Failures: 0, Errors: 0]]",
      "resolved_path": "results/kernel/memory-tests-final-14-post-coverage-fix.log",
      "status": "anchored",
      "subject_kind": "text-artifact",
      "subject_path": "paper.tex",
      "target": "results/kernel/memory-tests-final-14-post-coverage-fix.log"
    },
    {
      "locator": "pareto_n1000_embedding1024_median_ms=2.537",
      "messages": [
        "Target path exists, but locator semantics were not interpreted by the base verifier."
      ],
      "raw_reference": "@evidence[[results/kernel/memory-tests-final-14-post-coverage-fix.log#pareto_n1000_embedding1024_median_ms=2.537]]",
      "resolved_path": "results/kernel/memory-tests-final-14-post-coverage-fix.log",
      "status": "anchored",
      "subject_kind": "text-artifact",
      "subject_path": "paper.tex",
      "target": "results/kernel/memory-tests-final-14-post-coverage-fix.log"
    },
    {
      "messages": [
        "Target path exists."
      ],
      "raw_reference": "@evidence[[figures/graphical_abstract.png.prov.json]]",
      "resolved_path": "figures/graphical_abstract.png.prov.json",
      "status": "resolved",
      "subject_kind": "text-artifact",
      "subject_path": "paper.tex",
      "target": "figures/graphical_abstract.png.prov.json"
    },
    {
      "locator": "results.full",
      "messages": [
        "Target path exists, but locator semantics were not interpreted by the base verifier."
      ],
      "raw_reference": "@evidence[[results/longmemeval_session_rerank/run_v2/summary.json#results.full]]",
      "resolved_path": "results/longmemeval_session_rerank/run_v2/summary.json",
      "status": "anchored",
      "subject_kind": "text-artifact",
      "subject_path": "paper.tex",
      "target": "results/longmemeval_session_rerank/run_v2/summary.json"
    },
    {
      "locator": "grounding_sources.retrieval-ranking-implementation",
      "messages": [
        "Target path exists, but locator semantics were not interpreted by the base verifier."
      ],
      "raw_reference": "@evidence[[paper_data.json#grounding_sources.retrieval-ranking-implementation]]",
      "resolved_path": "paper_data.json",
      "status": "anchored",
      "subject_kind": "text-artifact",
      "subject_path": "paper.tex",
      "target": "paper_data.json"
    },
    {
      "locator": "hypothesis",
      "messages": [
        "Target path exists, but locator semantics were not interpreted by the base verifier."
      ],
      "raw_reference": "@evidence[[paper_data.json#hypothesis]]",
      "resolved_path": "paper_data.json",
      "status": "anchored",
      "subject_kind": "text-artifact",
      "subject_path": "paper.tex",
      "target": "paper_data.json"
    },
    {
      "locator": "grounding_sources.retrieval-ranking-implementation",
      "messages": [
        "Target path exists, but locator semantics were not interpreted by the base verifier."
      ],
      "raw_reference": "@evidence[[paper_data.json#grounding_sources.retrieval-ranking-implementation]]",
      "resolved_path": "paper_data.json",
      "status": "anchored",
      "subject_kind": "text-artifact",
      "subject_path": "paper.tex",
      "target": "paper_data.json"
    },
    {
      "locator": "grounding_sources.retrieval-ranking-implementation",
      "messages": [
        "Target path exists, but locator semantics were not interpreted by the base verifier."
      ],
      "raw_reference": "@evidence[[paper_data.json#grounding_sources.retrieval-ranking-implementation]]",
      "resolved_path": "paper_data.json",
      "status": "anchored",
      "subject_kind": "text-artifact",
      "subject_path": "paper.tex",
      "target": "paper_data.json"
    },
    {
      "locator": "grounding_sources.retrieval-ranking-implementation",
      "messages": [
        "Target path exists, but locator semantics were not interpreted by the base verifier."
      ],
      "raw_reference": "@evidence[[paper_data.json#grounding_sources.retrieval-ranking-implementation]]",
      "resolved_path": "paper_data.json",
      "status": "anchored",
      "subject_kind": "text-artifact",
      "subject_path": "paper.tex",
      "target": "paper_data.json"
    },
    {
      "locator": "grounding_sources.retrieval-ranking-implementation.locators.long_term_integration_tests",
      "messages": [
        "Target path exists, but locator semantics were not interpreted by the base verifier."
      ],
      "raw_reference": "@evidence[[paper_data.json#grounding_sources.retrieval-ranking-implementation.locators.long_term_integration_tests]]",
      "resolved_path": "paper_data.json",
      "status": "anchored",
      "subject_kind": "text-artifact",
      "subject_path": "paper.tex",
      "target": "paper_data.json"
    },
    {
      "locator": "results.n1000_embedding_dimensions",
      "messages": [
        "Target path exists, but locator semantics were not interpreted by the base verifier."
      ],
      "raw_reference": "@evidence[[paper_data.json#results.n1000_embedding_dimensions]]",